id,author,datetime,domain,url,title,num_comments
t2ylxa,Bilijean91,2022-02-27 13:41:37,i.redd.it,https://i.redd.it/y6klhmnw3gk81.jpg,Blacks in Ukraine not allowed to leave!,0
t2zry9,__402_robotoki,2022-02-27 14:36:27,youtube.com,https://www.youtube.com/watch?v=rHtZ1Ch8bNE,Segregation(racism) of blacks and white being done in Ukraine and at the Polis border. In such times as this why divide people instead of unite them against a common enemy. Why isn't this being publish by media outlets.,0
t3a8is,bdix004,2022-02-27 23:48:22,youtube.com,https://youtube.com/watch?v=43u55F2YOEY&amp;feature=share,Treatment Of Blacks In Ukraine Despicable,0
t3swhl,ImpossibleStill1410,2022-02-28 15:15:18,youtu.be,https://youtu.be/v_79KyF2JoY,"Watch ""Open Racism of White Supremacy in Ukraine against Blacks, Indians, Muslims. Warning Hurtful Language"" on YouTube",1
t40tko,whitelightstorm,2022-02-28 21:53:57,urbanhollywood411.com,https://urbanhollywood411.com/2022/02/27/african-students-fleeing-ukraine-report-being-told-no-blacks-on-buses/,Black Students Trying to flee being told in Ukraine: *No Blacks Allowed on Buses*,6
t41cro,collapse-jeeves,2022-02-28 22:25:06,np.reddit.com,https://np.reddit.com/r/collapse/comments/t40tko/black_students_trying_to_flee_being_told_in/,[3] Black Students Trying to flee being told in Ukraine: *No Blacks Allowed on Buses*,0
t4k379,One-Designer-9406,2022-03-01 14:21:59,i.redd.it,https://i.redd.it/8rrul7hxkuk81.jpg,"Ukraine treat your students well, we are not happy what’s happening in Ukraine and it’s not the blacks fault. We are sorry for Ukraine just as the world is sorry for u. #powertothepeopleofukraine #freeukraine",0
t4tkfo,[deleted],2022-03-01 22:15:04,youtube.com,https://www.youtube.com/watch?v=4ttl8ZfW5V0,All my dggas support Blacks in Ukraine,1
t4xf3m,sili09,2022-03-02 02:38:40,mobile.twitter.com,https://mobile.twitter.com/mjavinod/status/1498814255298072576,Blacks being kicked off train in Ukraine to make space for blond haired blue eyed people,0
t8p8du,BrownsFan1964,2022-03-07 05:28:53,self.ukraine,https://www.reddit.com/r/ukraine/comments/t8p8du/do_you_think_ukraine_is_tryin_to_keep_in_blacks/,Do you think Ukraine is tryin to keep in blacks?,0
